{
  "$schema": "https://json-schema.org/draft/2020-12/schema",
  "$id": "https://schemas.openghm.org/snapshot-spec/metadata/1.0.0.json",
  "title": "OpenGHM snapshot metadata",
  "description": "metadata.json for one WBM snapshot. Fields are grouped by where their contents come from: about (a person, at publish), simulation (derived from the selected .init), uses (the publisher, at publish), runtime (the system). See docs/reference/metadata-format.md.",
  "type": "object",
  "additionalProperties": false,
  "required": ["$schema", "id", "slug", "about", "simulation", "uses", "runtime"],
  "properties": {
    "$schema": {
      "type": "string",
      "format": "uri",
      "description": "This document's own schema version URL, e.g. https://schemas.openghm.org/snapshot-spec/metadata/1.0.0.json."
    },
    "id": {
      "type": "string",
      "pattern": "^[0-9a-f]{64}$",
      "description": "Minted at publish, 256 random bits as lowercase hex. Not derived from the snapshot's content (ADR 0014). The S3 key under snapshots/."
    },
    "slug": {
      "type": "string",
      "pattern": "^[a-z0-9][a-z0-9_.-]*$",
      "description": "The human name at publish time. Not part of the S3 key; the catalog maps slug to id for browsing, and may remap it later without touching this file."
    },
    "about": { "$ref": "../../common/about/1.0.0.json" },
    "simulation": { "$ref": "#/$defs/simulation" },
    "uses": { "$ref": "#/$defs/uses" },
    "runtime": { "$ref": "#/$defs/runtime" }
  },
  "$defs": {
    "simulation": {
      "type": "object",
      "additionalProperties": false,
      "required": ["init", "spatialCoverage", "resolution", "temporalCoverage", "inputVariables", "activeProcesses", "outputVariables", "recommendedCompute"],
      "properties": {
        "init": {
          "type": "string",
          "pattern": "^[^/].*\\.init$",
          "description": "Path relative to wbm_init/, not a bare filename assumption — a snapshot can hold several .init files. Resolves to <snapshot>/wbm_init/<init>."
        },
        "spatialCoverage": { "$ref": "../../common/spatial-coverage/1.0.0.json" },
        "resolution": {
          "type": "object",
          "additionalProperties": false,
          "required": ["value", "unit"],
          "properties": {
            "value": { "type": "number", "exclusiveMinimum": 0 },
            "unit": { "type": "string", "enum": ["arc-minute", "arc-second", "degree"] }
          }
        },
        "temporalCoverage": {
          "type": "object",
          "additionalProperties": false,
          "required": ["start", "end"],
          "properties": {
            "start": { "type": "string", "format": "date" },
            "end": { "type": "string", "format": "date" }
          }
        },
        "inputVariables": {
          "type": "array",
          "minItems": 1,
          "description": "What the run is driven by: one entry per forcing time series the .init actually names — see metadata-format.md#forcing-roles. Variable length, not a fixed pair, but `role` is a closed vocabulary and a new role is an additive MINOR bump. `role` is unique within the array; JSON Schema cannot express that, so the generator and the validator enforce it.",
          "items": {
            "type": "object",
            "additionalProperties": false,
            "required": ["role", "dataset"],
            "properties": {
              "role": {
                "type": "string",
                "enum": [
                  "precipitation",
                  "precipitationFraction",
                  "airTemperature",
                  "windU",
                  "windV",
                  "cloudFraction",
                  "humidity",
                  "albedo",
                  "leafAreaIndex"
                ]
              },
              "dataset": {
                "type": "string",
                "minLength": 1,
                "description": "The MT record driving this role, named by its own Code_Name field — read from inside the .init the run's MT_* key points at, not assumed from that file's basename. The two agree for the climate forcing used today (merra2_prectotcorr_d.init declares Code_Name merra2_prectotcorr_d) but not in general: several records in the staged ancillary data declare a Code_Name that differs from their filename (see model-input-spec's datasets[].code)."
              },
              "fullName": {
                "type": "string",
                "minLength": 1,
                "description": "The MT record's Name, e.g. 'MERRA2 Temperature at 2m, Daily'. Optional because it is copied out of a file that leaves the bundle under ADR 0015 — recording it here is what keeps this document readable without that file."
              },
              "unit": {
                "type": "string",
                "minLength": 1,
                "description": "The MT record's Units — what WBM reads the series as, after Var_Scale and Var_Offset. NOT Orig_Units, which is the unit of the file on disk before scaling (e.g. K, not C; kg/(m^2 s), not mm/day). Optional for the same reason as fullName."
              }
            }
          }
        },
        "activeProcesses": {
          "type": "array",
          "uniqueItems": true,
          "items": { "type": "string", "minLength": 1 }
        },
        "outputVariables": {
          "type": "array",
          "minItems": 1,
          "description": "What the run computes: one entry per name in the .init's Output_vars, resolved through the model's variable dictionary — see metadata-format.md.",
          "items": {
            "type": "object",
            "additionalProperties": false,
            "required": ["name", "fullName", "unit"],
            "properties": {
              "name": { "type": "string", "minLength": 1 },
              "fullName": { "type": "string", "minLength": 1, "description": "The dictionary's Full_name." },
              "unit": { "type": "string", "minLength": 1, "description": "The dictionary's Org_units[0] — the native unit, not an aggregated one." }
            }
          }
        },
        "recommendedCompute": {
          "type": "object",
          "additionalProperties": false,
          "required": ["cores", "walltime"],
          "properties": {
            "cores": { "type": "integer", "minimum": 1 },
            "walltime": { "$ref": "#/$defs/slurmTime" }
          }
        }
      }
    },
    "uses": {
      "type": "object",
      "additionalProperties": false,
      "required": ["container", "modelInput"],
      "properties": {
        "container": {
          "type": "object",
          "additionalProperties": false,
          "required": ["image", "version", "digest", "oras", "https"],
          "properties": {
            "image": { "type": "string", "minLength": 1 },
            "version": { "type": "string", "minLength": 1 },
            "digest": { "type": "string", "pattern": "^sha256:[0-9a-f]{64}$" },
            "oras": { "type": "string", "pattern": "^oras://" },
            "https": { "type": "string", "format": "uri" }
          }
        },
        "modelInput": {
          "type": "object",
          "additionalProperties": false,
          "required": ["id", "mountAs"],
          "properties": {
            "id": {
              "type": "string",
              "pattern": "^[0-9a-f]{64}$",
              "description": "Minted at publish, same rule as the snapshot id (ADR 0014). Two snapshots built from the same input data share this value."
            },
            "mountAs": {
              "type": "string",
              "minLength": 1,
              "description": "Selector, not a path: the data/ child this model input is materialised as. Resolves to <snapshot>/data/<mountAs>, mounted at /wbm/data."
            }
          }
        }
      }
    },
    "runtime": {
      "type": "object",
      "additionalProperties": false,
      "required": ["generatedAt", "execution"],
      "properties": {
        "generatedAt": { "type": "string", "format": "date-time" },
        "execution": {
          "type": "object",
          "additionalProperties": false,
          "required": ["cluster", "cores", "elapsedWalltime", "startedAt", "finishedAt", "slurmJobId"],
          "properties": {
            "cluster": {
              "type": "string",
              "enum": ["anvil"],
              "description": "Every compute-node fact in this project assumes one cluster today. A second cluster is an additive MINOR bump."
            },
            "cores": { "anyOf": [{ "type": "integer", "minimum": 1 }, { "$ref": "#/$defs/unknown" }] },
            "elapsedWalltime": { "anyOf": [{ "$ref": "#/$defs/slurmTime" }, { "$ref": "#/$defs/unknown" }] },
            "startedAt": { "anyOf": [{ "type": "string", "format": "date-time" }, { "$ref": "#/$defs/unknown" }] },
            "finishedAt": { "anyOf": [{ "type": "string", "format": "date-time" }, { "$ref": "#/$defs/unknown" }] },
            "slurmJobId": { "anyOf": [{ "type": "string", "pattern": "^[0-9]+$" }, { "$ref": "#/$defs/unknown" }] }
          }
        }
      }
    },
    "slurmTime": {
      "type": "string",
      "pattern": "^([0-9]+-)?[0-9]{1,3}(:[0-9]{2}){0,2}$",
      "description": "SLURM --time syntax, not an ISO 8601 duration: minutes, minutes:seconds, hours:minutes:seconds, days-hours[:minutes[:seconds]]. Hours are not capped at 24 (observed: 111:30:00)."
    },
    "unknown": {
      "const": "unknown",
      "description": "Recorded when a past run's own record (SLURM accounting, logs) could not be recovered at rewrite time. Allowed only in runtime.execution's observation fields (cores, elapsedWalltime, startedAt, finishedAt, slurmJobId), never in cluster or anywhere else."
    }
  }
}
