{
  "$schema": "https://schemas.openghm.org/snapshot-spec/metadata/1.0.0.json",
  "id": "fc66a2cdeee9d456f83bc0b0a6f00cd447b0194c124a3bb4008a02990779ec89",
  "slug": "wbm_storage_v2.0.0",

  "about": {
    "name": "WBM v2.0.0 simulation as tutorial: [CONUS] [2000-2001]",
    "description": "A simple WBM simulation that was used in 2023 user community WBM workshop",
    "datePublished": "2026-09-23",
    "category": "tutorial",
    "creator": [
      { "name": "Jordan Rivera", "email": "jordan.rivera@example.edu" },
      { "name": "Sam Whitfield", "email": "sam.whitfield@example.edu" },
      { "name": "Casey Nolan", "email": "casey.nolan@example.edu" }
    ],
    "license": "GPL-3.0-only",
    "keywords": ["Water Balance Model", "WBM tutorial", "hydrology"],
    "url": "https://openghm.org/snapshots/fc66a2cdeee9d456f83bc0b0a6f00cd447b0194c124a3bb4008a02990779ec89",
    "relatedLink": [
      {
        "relation": "isDescribedBy",
        "roleName": "Primary Publication",
        "url": "https://gmd.copernicus.org/articles/15/7287/2022/",
        "doi": "10.5194/gmd-15-7287-2022",
        "description": "Primary publication describing the model methodology."
      }
    ]
  },

  "simulation": {
    "init": "wbm_test.init",
    "spatialCoverage": {
      "northlimit": 57.1667, "southlimit": 21.75, "eastlimit": -60.5833, "westlimit": -127.8333,
      "units": "Decimal degrees", "projection": "EPSG:4326"
    },
    "resolution": { "value": 5, "unit": "arc-minute" },
    "temporalCoverage": { "start": "2000-01-01", "end": "2001-12-31" },
    "inputVariables": [
      { "role": "precipitation",  "dataset": "merra2_prectotcorr_d",
        "fullName": "MERRA2 Total Surface Precipitation, bias corrected, Daily", "unit": "mm/day" },
      { "role": "airTemperature", "dataset": "merra2_t2m_d",
        "fullName": "MERRA2 Temperature at 2m, Daily", "unit": "C" }
    ],
    "activeProcesses": [
      "Evaporation from Open Water"
    ],
    "outputVariables": [
      { "name": "runoff", "fullName": "Runoff", "unit": "mm/day" },
      { "name": "discharge", "fullName": "Discharge", "unit": "m3/sec" },
      { "name": "streamAge", "fullName": "Stream Age (water residence time)", "unit": "days" }
    ],
    "recommendedCompute": { "cores": 16, "walltime": "15:00" }
  },

  "uses": {
    "container": {
      "image": "wbm-v2-lite",
      "version": "2.0.0",
      "digest": "sha256:4ef9e35b3c15f08721a165cccb15266ab812f5fa51e0266d36061e9a77f222ea",
      "oras": "oras://registry.openghm.org/openghm/wbm-v2-lite@sha256:a9fc0281ed4010fcb89c788edcd53639cfc4fe76e5bc6b245d8c407d7cc76f43",
      "https": "https://s3.anvil.rcac.purdue.edu/openghm/containers/wbm-v2-lite/2.0.0/wbm-v2-lite-2.0.0.sif"
    },
    "modelInput": {
      "id": "52585562109e15bd7b06fad0e6deb17d1f4fa72a38474828adac5e74c169bc5d",
      "mountAs": "wbm_ancillary_data_v2.0.0"
    }
  },

  "runtime": {
    "generatedAt": "2026-09-28T18:49:37Z",
    "execution": {
      "cluster": "anvil",
      "cores": 4,
      "elapsedWalltime": "13:53",
      "startedAt": "2026-09-26T00:37:28Z",
      "finishedAt": "2026-09-26T00:51:21Z",
      "slurmJobId": "20909227"
    }
  }
}
